NOMREG;NOMDEP;ANNEXE;NOM DU MUSEE;ADR;CP;VILLE;TELEPHONE1;FAX;SITWEB;FERMETURE ANNUELLE;PERIODE OUVERTURE;JOURS NOCTURNES
MIDI-PYRENEES;AVEYRON;;MusÇe Soulages;"Jardin du Foirail
Avenue Victor Hugo";12000;RODEZ;0565738244;;http://musee-soulages.rodezagglo.fr/;1er janvier, 1er mai, 1er novembre et 25 dÇcembre;Ouvert d'avril Ö juin du mardi au dimanche de 11h Ö 19h, en juillet-aoñt le lundi de 14h Ö 19h et du mardi au dimanche inclus de 10h Ö 19h, en septembre du mardi au dimanche inclus de 11h Ö 19h, d'octobre Ö avril du mardi au vendredi de 10h Ö 12h et de 14;
MIDI-PYRENEES;AVEYRON;;MusÇe Fenaille;14, Place Eugäne Raynaldy;12000;RODEZ;0565738430;0565738431;http://musee-fenaille.rodezagglo.fr/;1er janvier, 1er mai, 1er novembre, 25 dÇcembre;Ouvert du 11 avril au 30 juin et du 1er au 30 septembre du mardi au samedi de 11h Ö 19h, le dimanche de 14h Ö 19h, en juillet-aoñt le lundi de 14h Ö 19h et du mardi au dimanche de 10h Ö 19h, du 1er octobre au 31 mars du mardi au vendredi de 10h Ö 12h et d;
MIDI-PYRENEES;AVEYRON;;MusÇe Municipal d'archÇologie;Rue Saint-Pierre;12250;ROQUEFORT-SUR-SOULZON;0565599195;0565599516;;;;
MIDI-PYRENEES;AVEYRON;;MusÇe des Arts et MÇtiers Traditionnels;;12330;SALLES-LA-SOURCE;0565672896;0565672896;www.musees-aveyron.fr;De novembre Ö mars;"Ouvert en avril et octobre les  mercredi , jeudi et dimanche de 14h Ö 18h, mai/juin/septembre du mercredi au lundi de 14h Ö 18h, juillet-aoñt du mardi au vendredi de 10h Ö 12h30 et de 13h30 Ö 18h30, les samedi, dimanche et lundi de 13h30 Ö 18h30
Visites";
MIDI-PYRENEES;AVEYRON;;MusÇe du Charroi Rural et de l'Artisanat Traditionnel;Ancienne Eglise Saint-Firmin;12120;SALMIECH;0565742355;0565742679;www.musee-charroi-rural-salmiech.fr;;Ouvert en Juillet et Aoñt tous les jours de 11h Ö 12h et de 14h30 Ö 18h30. Autres jours de l'annÇe, sur rendez-vous;
MIDI-PYRENEES;AVEYRON;;MusÇe Municipal Urbain Cabrol;Place de la Fontaine;12200;VILLEFRANCHE-DE-ROUERGUE;0565454437;0565450170;www.villefranchederouergue.fr;Jours fÇriÇs;Ouvert d'avril Ö juin et septembre du mardi au samedi de 14h Ö 18h, juillet-aoñt du mardi au samedi de 10h Ö 12h et de 14h30 Ö 18h30;
MIDI-PYRENEES;GERS;;MusÇe des Jacobins;4, Place Louis Blanc;32000;AUCH;0562057479;0562619095;www.musee-jacobins.auch.fr www.auch-tourisme.com ou site de la mairie;Janvier et jours fÇriÇs;Ouvert du 1er fÇvrier au 31 mars et du 1er novembre au 31 dÇcembre du lundi au vendredi de 14h Ö 17h, le samedi samedi et dimanche de 10h Ö 12h et de 14h Ö 17h, du 1er avril au 31 octobre tous les jours de 10h Ö 12h et de 14h Ö 18h;
MIDI-PYRENEES;GERS;;MusÇe de l'Armagnac;2, Rue Jules Ferry;32100;CONDOM;0562284717;0562284705;site du dÇpartement : www.gers-gascogne.com;Janvier;Ouvert de novembre Ö mars du mercredi au dimanche de 14h Ö 17h et d'avril Ö octobre du mercredi au lundi de 10h Ö 12h et de 15h Ö 18h;
MIDI-PYRENEES;GERS;;MusÇe ArchÇologique;Place de la RÇpublique;32180;EAUZE;0562097138;0562097920;site du dÇpartement : www.gers-gascogne.com ou site de la mairie;Janvier,  1er week-end de juillet;Ouvert du 1er mars au 30 juin et du 1er septembre au 30 novembre tous les jours de 10h Ö 12h et de 14h Ö 18h, du 1er juillet au 31 aoñt tous les jours de 10h Ö 19h;
MIDI-PYRENEES;GERS;;MusÇe d'ArchÇologie;"Place du GÇnÇral de Gaulle
Hìtel de Ville";32700;LECTOURE;0562687022;0562689160;site du dÇpartement : www.gers-gascogne.com;Jours fÇriÇs;"Ouvert du 1er mars au 30 septembre de 10h Ö 12h et de 14h Ö 18h.
Du 1er octobre au 28 fÇvrier de 10h Ö 12h et de 14h Ö 18h";
MIDI-PYRENEES;GERS;;MusÇe Campanaire;Place de l'Hìtel de ville;32600;L'ISLE JOURDAIN;0562073001;0562071222;site du dÇpartement : www.gers-gascogne.com;1er janvier au 15 janvier, 1er mai, 25 dÇcembre;Ouvert du 15 juin au 14 septembre de 10h Ö 12h et de 14h30 Ö 18h30, du 15 septembre au 14 juin de 10h Ö 12h et de 14h30 Ö 17h30;
MIDI-PYRENEES;GERS;;MusÇe Joseph Abeilhe;"Mairie de Marciac
19, Place de l'Hìtel de Ville";32230;MARCIAC;0562093803;0562082310;Site de la rÇgion : www.musees-midi-pyrenees.fr;;Ouvert du lundi au vendredi de 8h30 Ö 12h et de 13h30 Ö 17h;
MIDI-PYRENEES;GERS;;MusÇe des Beaux-Arts et des Arts DÇcoratifs;13, rue de l'EvàchÇ;32300;MIRANDE;0562666810;0562668709;site du dÇpartement : www.gers-gascogne.com;Jours fÇriÇs;Ouvert du lundi au vendredi de 9h Ö 12h et de 14h Ö 18h, le samedi de 10h Ö 12h et de 15h Ö 18h, et le dimanche de 10h Ö 12h en juillet aoñt;
MIDI-PYRENEES;HAUTE-GARONNE;;MusÇe de PrÇhistoire;Avenue de Benabarre;31420;AURIGNAC;0561909072;0561987133;www.musee-aurignacien.com;Janvier, 1er mai, 1er novembre, 25 dÇcembre;Ouvert de septembre Ö juin du mercredi au dimanche de 14h Ö 18h, et en juillet-aoñt et vacances zone C du mardi au dimanche de 10h Ö 18h;
MIDI-PYRENEES;HAUTE-GARONNE;;MusÇe du Pays de Luchon;18, AllÇe d'Etigny;31110;BAGNERES-DE-LUCHON;0561792987;0561791123;www.luchon.com ou www.mairies-luchon.fr -www.musees-midi-pyrenees.fr;Jours fÇriÇs;Ouvert en janvier et dÇcembre le mardi, jeudi et vendredi de 10h Ö 12h et de 15h Ö 18h, le mercredi, samedi et dimanche de 9h Ö 12h et de 14h Ö 18h. De fÇvrier Ö juin et de septembre Ö octobre le lundi, mardi, jeudi et vendredi de 10h Ö 12h et de 15h Ö 18;
MIDI-PYRENEES;HAUTE-GARONNE;;MusÇe Municipal;Place Henri Dulion;31220;MARTRES-TOLOSANE;0561986641;0561985929;www.tourisme-martres-tolosane.fr;Premiäre semaine de janvier;Ouvert du mardi au vendredi de 9h30 Ö 12h30 et de 13h30 Ö 17h30 de dÇcembre Ö fÇvrier, de mars Ö mi-juin et de mi-septembre Ö fin novembre du mardi au samedi de 9h30 Ö 12h30 et de 13h30 Ö 17h30 et de mi-juin Ö mi septembre tous les jours et jours fÇriÇs d;
MIDI-PYRENEES;HAUTE-GARONNE;;MusÇe ArchÇologique DÇpartemental;BÉtiment de l'Ancienne Gendarmerie;31510;SAINT-BERTRAND-DE-COMMINGES;0561883179;0561888381;http://www.musees-midi-pyrenees.fr/musees/musee-archeologique-departemental;Janvier;Expositions temporaires tous les jours de 10h Ö 17h de mai Ö septembre;
MIDI-PYRENEES;HAUTE-GARONNE;;MusÇe Municipal d'Art et d'Histoire;6, place de Mas Saint Pierre;31800;SAINT-GAUDENS;0561890542;0561947866;www.mairiestgaudens.fr;;"Exposition hors les murs
Juillet-aoñt - du lundi au samedi de 9h Ö 12h et de 13h30 Ö 18h
Sept.-nov. : du mardi au samedi de 14h30 Ö 18h, sauf jeudi de 10h Ö 12h30";
MIDI-PYRENEES;HAUTE-GARONNE;;Les Abattoirs, MusÇe d'Art Moderne et Contemporain;76, allÇes Charles-de-Fitte;31300;TOULOUSE;0562485800;0562485801;www.lesabattoirs.org;1er janvier, 1er mai et 25 dÇcembre;Ouvert du mercredi au dimanche de 12h Ö 18h , nocturne le jeudi jusqu'Ö 20h;
MIDI-PYRENEES;HAUTE-GARONNE;;MusÇe Paul Dupuy;13, Rue de la PlÇau;31000;TOULOUSE;0531229540;0561146559;Site des musÇes de la rÇgion : www.musees-midi-pyrenees.fr/;Jours fÇriÇs;Ouvert du mardi au dimanche de 10h Ö 17h d'octobre Ö mai et de 10h Ö 18h de juin Ö septembre;
MIDI-PYRENEES;HAUTE-GARONNE;;MusÇe Georges Labit;17, rue du Japon;31400;TOULOUSE;0561534825;0561146559;;Jours fÇriÇs;Ouvert du mardi au dimanche de 10h Ö 17h d'octobre Ö mai et de 10h Ö 18h de juin Ö septembre;
MIDI-PYRENEES;HAUTE-GARONNE;;MusÇe du Vieux Toulouse;"Hìtel Dumay
7, Rue du May";31000;TOULOUSE;0562271150;0562275088;htt://toulousainsdetoulouse.fr;Jours fÇriÇs;Ouvert de mi-avril Ö mi-novembre du lundi au samedi de 14h Ö 18h. Ouvert toute l'annÇe sur rendez-vous pour les groupes.;
MIDI-PYRENEES;HAUTE-GARONNE;;MusÇe des Transports et des Communications;93, avenue Jules Julien;31400;TOULOUSE;0561550210;0561550210;http://asptuit.free.fr;;Ouvert les jeudis de 10h Ö 12h et de 14h Ö 16h et sur rendez-vous;
MIDI-PYRENEES;HAUTE-GARONNE;;MusÇum d'Histoire Naturelle;35, allÇes Jules Guesde;31000;TOULOUSE;0567738484;0567738448;www.museum.toulouse.fr;1er janvier, 1er mai, 25 dÇcembre;Ouvert de 10h Ö 18h du mardi au dimanche;
MIDI-PYRENEES;HAUTE-GARONNE;;MusÇe des Augustins;21, rue de Metz;31000;TOULOUSE;0561222182;0561223469;www.augustins.org;;Ouvert tous les jours de 10h Ö 18h. Nocturne le mercredi jusqu'Ö 21h;Mercredi jusqu'Ö 21h
MIDI-PYRENEES;HAUTE-GARONNE;;MusÇe Saint-Raymond;1, Place Saint Sernin;31000;TOULOUSE;0561223144;0561223125;www.SaintRaymond.toulouse.fr;1er janvier, 1 mai et 25 dÇcembre;Ouvert tous les jours de 10h Ö 18h, de 10h Ö 19h du 1er juillet au 31 aoñt. Fermeture exceptionnelle Ö 17h les 24 et 31 dÇcembre;
MIDI-PYRENEES;HAUTES-PYRENEES;;MusÇe de la Vie Quotidienne dans les PyrÇnÇes;Rue Hount-Blanque;65200;BAGNERES-DE-BIGORRE;0562910733;;;;;
MIDI-PYRENEES;HAUTES-PYRENEES;;MusÇe Salies;Place des Thermes;65200;BAGNERES-DE-BIGORRE;0562910726;0562910293;www.museesbagneres.fr/;;Ouvert du mercredi au dimanche de 10h Ö 12h et de 14h Ö 18h, samedi et dimanche de 15h Ö 18h;
MIDI-PYRENEES;HAUTES-PYRENEES;;MusÇum d'Histoire Naturelle;7, Place des Thermes de Salut;65200;BAGNERES-DE-BIGORRE;0562911205;;www.museesbagneres.fr/;;Ouvert de mai Ö octobre du mercredi au dimanche de 15h Ö 18h, de novembre Ö avril le mercredi et dimanche de 15h Ö 18h;
MIDI-PYRENEES;HAUTES-PYRENEES;;MusÇe PyrÇnÇen;ChÉteau fort;65100;LOURDES;0562423737;0562423744;www.chateaufort-lourdes.fr ou site de la ville - http://www.lourdes-visite.com/;1er janvier, 1er & 11 novembre, 25 dÇcembre;Ouvert de janvier Ö mi-avril de 10h Ö 18h, le lundi de 14h Ö 18h, de mi-avril Ö mi-octobre de 10h Ö 19h  et de mi-octobre Ö fin dÇcembre de 10h Ö 18h et le lundi de 14h Ö 18h;
MIDI-PYRENEES;HAUTES-PYRENEES;;MusÇe Municipal;Presbytäre;65120;LUZ-SAINT-SAUVEUR;0562923588;;;;Ouvert tous les jours de juin Ö septembre de 16h Ö 18h30;
MIDI-PYRENEES;HAUTES-PYRENEES;;MusÇe-chÉteau Gaston PhÇbus;ChÉteau-Fort de Mauvezin;65130;MAUVEZIN;0562391027;0562391027;www.chateaudemauvezin.com;;Ouvert tous les jours du 16 octobre au 14 avril de 13h30 Ö 17h30 et du 15 avril au 15 octobre de 10h Ö 19h;
MIDI-PYRENEES;HAUTES-PYRENEES;;MusÇe Massey;"Rue Achille Jubinal
Jardin Massey";65000;TARBES;0562361283;0562363251;www.musee-massey.com;1er janvier, 1er mai, 25 dÇcembre;Ouvert du mercredi au lundi de 10h Ö 12h30 et de 13h30 Ö 19h du 15 octobre au 15 avril et de 10h Ö 12h et de 14h Ö 17h du 14 avril au 16 octobre;
MIDI-PYRENEES;LOT;;MusÇe de PrÇhistoire de Cabrerets;"Centre de PrÇhistoire du Pech Merle
Mairie";46330;CABRERETS;0565312333;0565302126;www.pechmerle.com;15 dÇcembre au 15 janvier;Ouvert tous les jours  d' avril au 11 novembre 2012 de 9h45 Ö 12h45 et de 13h45 Ö 18h30;
MIDI-PYRENEES;LOT;;MusÇe Henri Martin;792, Rue Emile Zola;46000;CAHORS;0565208866;0565224443;www.mairie-cahors.fr/musee;1er janvier, 1er mai, 25 dÇcembre et pendant les montages d'expositions;Ouvert du mercredi au lundi de 11h Ö 18h, dimanche et jours fÇriÇs de 14h Ö 18h;
MIDI-PYRENEES;LOT;;MusÇe d'Histoire de Figeac;"Rue Victor Delbos
Cour du Puy";46100;FIGEAC;0565340625;0565500458;http://www.musee-champollion.fr/;;Ouvert en juillet ? aoñt de 14h30 Ö 18h30, tous les jours, et pour les groupes, sur rÇservation aupräs du musÇe Champollion;
MIDI-PYRENEES;LOT;;MusÇe Champollion - Les Ecriture du Monde;4, Rue des Fräres Champollion;46100;FIGEAC;0565503108;0565501679;www.musee-champollion.fr;1er janvier, 1er mai, 25 dÇcembre;Ouvert juillet-aoñt tous les jours de 10h30 Ö 18h30, et du mardi au dimanche d'avril Ö  juin et septembre-octobre de 10h30 Ö 12h30 et de 14h Ö 18h, de novembre Ö mars de 14h Ö 17h30. Ouvert les lundis de PÉques et de Pentecìte;
MIDI-PYRENEES;LOT;;MusÇe Murat;Place de Tolentino;46240;LABASTIDE MURAT;0565352363;0565311398;site de l'association des amis du musÇe;;Ouvert du mercredi au lundi du 15 juillet au 15 septembre de 10h Ö 12h et de 15h Ö 18h ainsi que les deux jours JEP;
MIDI-PYRENEES;LOT;;"MusÇe ArchÇologique ""Armand-VirÇ""";Rue de la Ville;46140;LUZECH;0565201727;0565201727;http://www.ville-luzech.fr/musee-archeologique-armand-vire-luzech;;Ouvert en juillet/aoñt de 10h Ö 13h et de 14h Ö 18h du lundi au samedi. Autre pÇriode contacter l'O.T.;
MIDI-PYRENEES;LOT;;MusÇe Gallo-Romain d'Uxellodunum;"Palais de la Raymondie
Place des Consuls";46600;MARTEL;0565373003;0565373727;;;Ouvert de 10h Ö 12h30 et de 15h Ö 18h30 en juillet-Aoñt;
MIDI-PYRENEES;LOT;;MusÇe d'Art SacrÇ;Parvis des Sanctuaires;46500;ROCAMADOUR;0565332330;0565332324;;;;
MIDI-PYRENEES;LOT;;MusÇe DÇpartemental de Cuzals;;46330;SAULIAC-SUR-CELE;0565534314;0565534369;www.museeduquercy.com;Entre octobre et avril;Ouvert de fin avril Ö juin et septembre du  mercredi au dimanche de 14h Ö 18h, en juillet-aoñt tous les jours de 10h Ö 19h;
MIDI-PYRENEES;LOT;;MusÇe de l'Automate;Place de l'Abbaye;46200;SOUILLAC;0565370707;0565327231;www.musee-automate.fr;1er janvier, 1er mai, 25 dÇcembre;Ouvert en  juillet-aoñt tous les jours de 10h Ö 12h30 et de 14h Ö 18h30, du mardi au dimanche d'avril Ö juin et en septembre/octobre de 10h Ö 12h et de 15h Ö 18h et du mardi au dimanche de janvier Ö mars et novembre/dÇcembre de 14h30 Ö 17h30;
MIDI-PYRENEES;LOT;;MusÇe Municipal;Mairie;46110;VAYRAC;0565324026;0565324130;http://www.vayrac.fr/uxellodunum.php?lg=fr;;Ouvert en juillet aoñt du mardi au dimanche de 10h Ö 12h et de 16h Ö 19h;
MIDI-PYRENEES;TARN;;MusÇe Toulouse Lautrec;"Palais de la Berbie
B.P. 100";81003;ALBI Cedex;0563494870;0563494888;www.musee-toulouse-lautrec.com;1er Janvier, 1er Mai, 1er Novembre, et 25 DÇcembre;Ouvert du mercredi au lundi de janvier Ö mars de 10h Ö 12h et de 14h Ö 17h30, d'avri Ö mai et octobre de 10h Ö 12h et de 14h Ö 18h, du 1er au 20 juin de 9h Ö 12h et de 14h Ö 18h de mi-juin au 30 septembre de 9h Ö 18h, en octobre de 10h Ö 12h et de 14h Ö 1;
MIDI-PYRENEES;TARN;;MusÇe EugÇnie et Maurice GuÇrin;ChÉteau de Cayla;81140;ANDILLAC;0563339030;0563773214;http://musee-cayla.tarn.fr/;;Ouvert en janvier et fÇvrier, samedi et dimanche de 14h Ö 17h, de mars Ö avril et de novembre Ö dÇcembre du mercredi au dimanche de 14h Ö 17h, de mai Ö juin et de septembre Ö octobre du mercredi au lundi de 10h Ö 12h et de 14h Ö 18h, juillet-aoñt tous les;
MIDI-PYRENEES;TARN;;MusÇe Jean Jauräs;2, Place PÇlisson;81100;CASTRES;0563624183;0563503902;http://www.ville-castres.fr/centre-national-et-musee-jean-jaures-presentation;1er janvier, 1er mai, 1er novembre, 25 dÇcembre;Ouvert du mardi au samedi de 10h Ö 12h et de 14h Ö 18h (17h du 1er octobre au 31 mars), juillet-aoñt ouvert tous les jours;
MIDI-PYRENEES;TARN;;MusÇe Goya;"Hìtel de Ville
B.P. 10406";81108;CASTRES Cedex;0563715930;0563715926;www.ville-castres.fr;1er janvier, 1er mai, 14 juillet, 1er novembre et 25 dÇcembre;Ouvert du 1er octobre au 31 mars de 9h Ö 12h et de 14h Ö 17h, du 1er avril au 30 septembre le dimanche et jours fÇriÇs de 9h Ö 12h et de 14h Ö 18h, en  juillet-aoñt tous les jours de 10h Ö 18h;
MIDI-PYRENEES;TARN;;MusÇe Charles Portal - Histoire et Patrimoine;"Porte des Ormeaux
1, Rue Saint-Michel";81170;CORDES-SUR-CIEL;0563560611;0563560611;http://musee-charles-portal.asso-web.com ou http://savieuxcordes.canalblog.com;;Ouvert de PÉques Ö la Toussaint vendredi, samedi, dimanche et jours fÇriÇs de 15h Ö 18 et en juillet-aoñt du mercredi au lundi de 14h30 Ö 18h30;
MIDI-PYRENEES;TARN;;MusÇe du protestantisme en Haut-Languedoc;"""La Ramade""";81260;FERRIERES;0563740549;0563734501;www.mprl.fr et www.musees-midi-pyrenees.fr;15 dÇcembre au 15 mars;Ouvert de juillet Ö septembre tous les jours de 10h Ö 12h et de 15h Ö 19h, mardi et dimanche de 15h Ö 19h, visites guidÇes Ö 15h30 et 17h, hors saison du lundi au vendredi de 14h Ö 17h, dimanches et jours fÇriÇs de 14h Ö 18h, visites guidÇes Ö 14h30 et 16;
MIDI-PYRENEES;TARN;;MusÇe de l'Abbaye Saint-Michel;Place Saint-Michel;81600;GAILLAC;0563410381;0563575683;site de la ville;1er janvier, 1er mai, 1er novembre et 25 dÇcembre;Ouvert de novembre Ö avril les vendredis, samedis et dimanches de 10h Ö 12h et de 14h Ö 18h, et de mai Ö octobre du mercredi au lundi de 10h Ö 12h et de 14h Ö 18h;
MIDI-PYRENEES;TARN;;MusÇe des Beaux-Arts;Avenue Dom-Vayssette;81600;GAILLAC;0563571825;0563575683;Site de la ville www.ville-gaillac.fr;Janvier;Ouvert de novembre Ö avril les vendredis, samedis et dimanches de 10h Ö 12h et de 14h Ö 18h, et de mai Ö octobre du mercredi au lundi de 10h Ö 12h et de 14h Ö 18h;
MIDI-PYRENEES;TARN;;MusÇum d'histoire naturelle Philadelphe Thomas;Place Philadelphe Thomas;81600;GAILLAC;0563573631;0563575683;Site de la ville :  www.ville-gaillac.fr;Janvier;Ouvert de novembre Ö avril les vendredis, samedis et dimanches de 10h Ö 12h et de 14h Ö 18h, et de mai Ö octobre du mercredi au lundi de 10h Ö 12h et de 14h Ö 18h;
MIDI-PYRENEES;TARN;;MusÇe DÇpartemental du Textile;Rue de la Rive;81270;LA-BASTIDE-ROUAIROUX;0563980860;0563983614;http://musees-departementaux.tarn.fr;1er mai, 1er novembre, 11 novembre et du 24 dÇcembre Ö fin fÇvrier;Ouvert de mars Ö avril du mercredi au dimanche de 14h Ö 17h, de mai Ö juin du mercredi au lundi de 10h Ö 12h et de 14h Ö 18h, de juillet Ö aoñt tous les jours de 10h Ö 12h30 et de 14h Ö 19h de septembre Ö octobre du mercredi au lundi de 10h Ö 12h et de 14;
MIDI-PYRENEES;TARN;;MusÇe du Pays Vaurais;1, rue Jouxaygues;81500;LAVAUR;0563580342;0563414289;www.musees-midi-pyrenees.fr/musees/musee-du-pays-vaurais;;"Ouvert du 15 mai au 15 juillet  mercredi et du vendredi au dimanche de 14h Ö 18h, du 15 juillet au 31 aoñt du samedi au lundi de 14h Ö 18h et du mardi au vendredi : 10h-12h et 14h00-18h et du 31 aoñt au 20 septembre 2015 :
14h-18h (du mardi au dimanche s";
MIDI-PYRENEES;TARN;;MusÇe Raymond Lafage;10, Rue Victor Mazies;81310;LISLE-SUR-TARN;0563404545;0563333618;www.ville-lisle-sur-tarn.fr - http://musee.lislesurtarn.over-blog.fr/;;Ouvert du mercredi au lundi de 10h Ö 12h et de 15h Ö 18h du 1er avril au 31 octobre;
MIDI-PYRENEES;TARN;;MusÇe du Pays Rabastinois;"Hìtel de La Fite
2, Rue AmÇdÇe Clausade";81800;RABASTENS;0563406565;0563336405;Site de la rÇgion : www.musees-midi-pyrenees.fr/musees/musee-du-pays-rabastinois;DÇcembre;Ouvert du mardi au vendredi de 10h Ö 12h et de 14h Ö 18h, samedi, dimanche et jours fÇriÇs de 14h Ö 18h;Nuit des musÇes
MIDI-PYRENEES;TARN-ET-GARONNE;;MusÇe du Vieil Auvillar;"Mairie
Place de la Halle";82340;AUVILLAR;0563395733;0563398982;www.auvillar.com;DÇcembre, janvier;Ouvert du 15 avril au 15 octobre du mercredi au lundi de 14h30 Ö 18h30 et du 16 octobre au 14 avril samedi et dimanche de 14h30 Ö 17h30;
MIDI-PYRENEES;TARN-ET-GARONNE;;MusÇe ThÇodore Calbet;15, Rue Jean de Comäre;82170;GRISOLLES;0563028306;0563673889;www.museecalbet.com;Jours fÇriÇs;Ouvert du mercredi au samedi de 15h Ö 18h et sur rendez-vous pour les groupes et les scolaires;
MIDI-PYRENEES;TARN-ET-GARONNE;;MusÇe des arts et traditions populaires;4, Rue de l'Abbaye;82200;MOISSAC;0563046363;0563046364;;;Ouvert d'avril Ö juin et de septembre Ö octobre du mardi au dimanche  de 10h Ö 12h et de 14h Ö 17h, en  juillet-aoñt tous les jours de 10h Ö 13h et de 14h Ö 18h;
MIDI-PYRENEES;TARN-ET-GARONNE;;MusÇe d'Histoire Naturelle Victor Brun;2, Place Antoine Bourdelle;82000;MONTAUBAN;0563221385;0563638947;www.museum.montauban.com/;Jours fÇriÇs;Ouvert du mardi au samedi de 10h Ö 12h et de 14h Ö 18h et le dimanche de 14h Ö 18h;
MIDI-PYRENEES;TARN-ET-GARONNE;;MusÇe Ingres;BP 752;82013;MONTAUBAN Cedex;0563221291;0563921699;www.montauban.com;1er janvier, 1er mai, 14 juillet, 1er novembre, 25 dÇcembre;Ouvert du 1er novembre au 30 mars du mardi au samedi de 10h Ö 12h et de 14h Ö 18h, le dimanche de 14h Ö 18h, du 1er avril au 31 octobre du mardi au dimanche de 10h Ö 12h et de 14h Ö 18h, de  juillet Ö septembre tous les jours de 10h Ö 18h;
MIDI-PYRENEES;TARN-ET-GARONNE;;MusÇe de PrÇhistoire;"Hìtel de Ville
Place de la Mairie";82140;SAINT-ANTONIN-NOBLE-VAL;0563682352;;Site de la ville : www.saint-antonin-noble-val.com;;Ouvert du mardi au samedi de 16h Ö 19h;
NORD-PAS-DE-CALAIS;NORD;;MusÇe ThÇophile Jouglet;215, Avenue Anatole-France;59410;ANZIN;0361321060;0327282101;site de la ville ou www.mediatheque-anzin.fr;;Ouverture du mardi au vendredi de 14h30 Ö 18h et le samedi de 14h30 Ö 18h30;
NORD-PAS-DE-CALAIS;NORD;;MusÇe d'Histoire et d'ArchÇologie;BP 90;59440;AVESNES-SUR-HELPE;0327611015;;http://www.annuaire-mairie.fr/musee-de-la-societe-archeologique-d-avesnes-sur-helpe.html#musee;;;
NORD-PAS-DE-CALAIS;NORD;;MusÇe Benoåt de Puydt;24, Rue du MusÇe de Puydt;59270;BAILLEUL;0328491270;0328443104;Site de la ville;1er et 8 mai, 14 juillet, 1er novembre, les 4 jours de carnaval, du 24 dÇcembre au 1er janvier;Ouvert de 14h Ö 17h30 du mercredi au dimanche de 14h Ö 17h30;
NORD-PAS-DE-CALAIS;NORD;;Forum Antique de Bavay, MusÇe ArchÇologique du DÇpartement du Nord;AllÇe Chanoine Henri BiÇvelet;59570;BAVAY;0359731550;0359731551;http://forumantique.lenord.fr/;1er janvier, 1er mai, 1er et 11 novembre, 25 dÇcembre - Fermetures annuelles la 1äre quinzaine de septembre et la 2äme quinzaine de janvier;Ouvert tous les jours de 9h Ö 12h et de 13h Ö 18h;
NORD-PAS-DE-CALAIS;NORD;;MusÇe du Mont-de-PiÇtÇ;1, Rue du Mont-de-PiÇtÇ;59380;BERGUES;0328681330;0328687125;www.musee-bergues.fr;;Ouvert du 5 mai au 30 septembre. Juin Ö aoñt du jeudi au lundi de 14h Ö 18h,  en mai et septembre de 14h Ö 17h  du jeudi au lundi et de 14h Ö 18h le week-end;
NORD-PAS-DE-CALAIS;NORD;;MusÇe de l'Ostrevant;192, rue Edouard Lalo;59111;BOUCHAIN;0327357397;;http://museedostrevant.canalblog.com/;;Ouvert le dimanche de 15h Ö 18h d'avril Ö octobre, les autres jours toute l'annÇe sur rendez-vous;
NORD-PAS-DE-CALAIS;NORD;;MusÇe Municipal de Cambrai;15, Rue de l'EpÇe;59400;CAMBRAI;0327822790;0327822791;www.villedecambrai.com/culture/musee.html;1er janvier, 1er et 8 mai, 14 juillet, 15 aoñt, 1er et 11 novembre, 25 dÇcembre;Ouvert du mercredi au dimanche de 10h Ö 12h et de 14h Ö 18h pour tous les publics et les lundis et mardis uniquement aux groupes sur rÇservation (8h30 Ö 12h30 et 14h Ö 18h);
NORD-PAS-DE-CALAIS;NORD;;MusÇe DiocÇsain d'Art SacrÇ;"Service de la conservation du patrimoine culturel
11, Rue du Grand SÇminaire - CS 80149";59403;CAMBRAI Cedex;0327813496;0327813491;www.liturgiecatholique.fr/Musee-diocesain-d-Art-Sacre-du.html ou http://archives.cathocambrai.com/;;Salle d'exposition ouverte 20 jours en 2012 (septembre-dÇcembre);
NORD-PAS-DE-CALAIS;NORD;;MusÇe DÇpartemental de Flandre;"26 Grand Place 
B.P. 38";59670;CASSEL;0359734560;0359734550;http://museedeflandre.lenord.fr/fr/Accueil.aspx;1er janvier, 1er mai, lundi de PÉques, lundi de Pentecìte, 25 dÇcembre;Ouvert du mardi au vendredi de 10h Ö 12h30 et de 14h Ö 18h, samedi et dimanche de 10h Ö 18h;Premier samedi du mois de 20h Ö 22h
NORD-PAS-DE-CALAIS;NORD;;MusÇe d'ArchÇologie et d'Histoire Locale;9, Place Wilson;59220;DENAIN;0327446212;0327235992;Site de la ville - www.ville-denain.fr;;Ouvert du mardi au vendredi de 14h Ö 18h, samedi de 16h Ö 18h et dimanche de 10h Ö 12h;
NORD-PAS-DE-CALAIS;NORD;;MusÇe de la Chartreuse;130, Rue des Chartreux;59500;DOUAI;0327713880;0327713884;www.museedelachartreuse.fr;1er janvier, 1er mai, ascension, 14 juillet, 15 aoñt, 1er & 11 septembre, 25 dÇcembre;Ouvert du mercredi au lundi de 10h Ö 12h et de 14h Ö 18h;
NORD-PAS-DE-CALAIS;NORD;;Lieu d'Art et Action Contemporaine de Dunkerque - LAAC;"Jardin des Sculptures
Avenue de Bains";59140;DUNKERQUE;0328295600;0328295601;www.musees-dunkerque.eu;1er janvier, dimanche & lundi apräs-midi prÇcÇdent mardi gras, 1er mai, 15 aoñt, 1er novembre, 24  et 31 am et 25 dÇcembre;Ouvert du mardi au dimanche de 10h Ö 12h15 et de 14h Ö 18h;3äme jeudi du mois jusqu'Ö 20h30 du 1er avril au 31 octobre
NORD-PAS-DE-CALAIS;NORD;;MusÇe Portuaire;"Entrepìt des Tabacs
9, Quai de la Citadelle";59140;DUNKERQUE;0328633339;0328650662;www.museeportuaire.fr;1er janvier, la veille du Mardi Gras, le 1er mai et le 25 dÇcembre;MusÇe Ö quai ouvert de 10h Ö 12h45 et de 13h30 Ö 18h, en juillet-aoñt tous les jours de 10h Ö 18h.  Le MusÇe Ö flot est ouvert le dimanche apräs-midi et pendant les vacances scolaires;
NORD-PAS-DE-CALAIS;NORD;;MusÇe des Beaux-Arts;"Place du GÇnÇral de Gaulle
B.P. 4212";59378;DUNKERQUE CEDEX;0328592165;0328664673;http://www.musees-dunkerque.eu;1er janvier, dimanche & lundi apräs-midi prÇcÇdent mardi gras, 1er mai, 15 aoñt, 1er novembre, 24  et 31 am et 25 dÇcembre;Ouvert du mercredi au lundi de 10h Ö 12h15 et de 14h Ö 18h;
NORD-PAS-DE-CALAIS;NORD;;MusÇe Municipal d'Escaudain;Rue Paul Bert;59124;ESCAUDAIN;0327321240;0327436273;http//clec.free.fr;;Ouvert le dimanche de 10h Ö 12h, et le premier dimanche du mois de 15h Ö 17h;
NORD-PAS-DE-CALAIS;NORD;;EcomusÇe de la RÇgion;"Place Maria Blondeau
B.P. 90031";59612;FOURMIES CEDEX;0327606611;0327608888;www.ecomusee-avesnois.fr;Du 15 dÇcembre  au 31 janvier;Ouvert de fÇvrier Ö novembre du mardi au vendredi de 9h Ö 12h et de 14h Ö 18h, week-end et jours fÇriÇs de 14h30 Ö 18h30;
NORD-PAS-DE-CALAIS;NORD;;MusÇe du Dessin et de l'Estampe Originale;"ChÉteau Arsenal
Place Charles Valentin";59820;GRAVELINES;0328518100;0328518101;www.gravelines-musee-estampe.fr;1er mai, le 1er novembre et du 24 dÇcembre au 1er janvier inclus;Ouvert du lundi, mercredi au vendredi de 14h Ö 17h, le week-end et jours fÇriÇs de 15h Ö 18h du 1er septembre au 30 juin et en juillet-aoñt le lundi, mercredi au vendredi de 14h Ö 18h, le week-end et jours fÇriÇs de 10h Ö 12h et de 15h Ö 18h;
NORD-PAS-DE-CALAIS;NORD;;MusÇe Municipal d'Hazebrouck;"Ancien Couvent des Augustins
Place Georges Degroote";59190;HAZEBROUCK;0328434446;0328407866;site de la ville;Jours fÇriÇs;Ouvert du mardi au dimanche de 14h Ö 17h30;
NORD-PAS-DE-CALAIS;NORD;;MusÇe DÇpartemental Matisse;"Palais FÇnelon
Place du Commandant Richez";59360;LE CATEAU-CAMBRESIS;0359733800;0359733801;www.cg59.fr ou www.tourisme-lecateau.fr/museematisse;1er janvier, 1er novembre, 25 dÇcembre;Ouvert du mercredi au lundi de 10h Ö 18h;
