NOMREG;NOMDEP;ANNEXE;NOM DU MUSEE;ADR;CP;VILLE;TELEPHONE1;FAX;SITWEB;FERMETURE ANNUELLE;PERIODE OUVERTURE;JOURS NOCTURNES
CHAMPAGNE-ARDENNE;HAUTE-MARNE;;MusÇe des Beaux-Arts et d'ArchÇologie;Place du Palais;52000;CHAUMONT;0325030199;0325012637;http://www.ville-chaumont.fr;1er janvier, 1er mai, 25 dÇcembre;Ouvert du mercredi au lundi de 14h Ö 18h de mi-septembre Ö mi-mai et de 14h30 Ö 18h30 du 14 mai au 18 septembre;
CHAMPAGNE-ARDENNE;HAUTE-MARNE;;Maison des Lumiäre Denis Diderot (ex MusÇe du Breuil de Saint-Germain);1, Place Pierre Burelle;52200;LANGRES;0325868640;;www.maisondeslumieres.org;1er Janvier, 1er Mai, 1er Novembre, et 25 DÇcembre;Ouvert du mardi au dimanche d'avril Ö septembre de 9h Ö 12h et de 14h Ö 19h et d'octobre Ö dimanche de 9h Ö 12h et 14h et 17h;
CHAMPAGNE-ARDENNE;HAUTE-MARNE;;MusÇe d'Art et d'Histoire;"Place du Centenaire
B.P. 183";52204;LANGRES Cedex;0325870805;0325888159;En cours de rÇalisation;;Ouvert tous les jours  d'avril Ö septembre de 9h Ö 12h et de 14h Ö 19h - d'octobre Ö mars de  de 9h Ö 12h et de 14h Ö 17h;
CHAMPAGNE-ARDENNE;HAUTE-MARNE;;MusÇe de la Coutellerie;"Place Charles de Gaulle
B.P. 1";52800;NOGENT;0325318921;0325322653;www.villedenogent52.com;Novembre Ö fÇvrier, 1er mai;"D'octobre Ö mai : tous les jours sauf lundi : 10h/12h ? 14h/18h
En juin et septembre tous les jours: 10h/12h ? 14h/18h
En juillet et aoñt tous les jours : 10h-12h30/13h30-19h00";
CHAMPAGNE-ARDENNE;HAUTE-MARNE;;MusÇe Municipal;17, Rue de la Victoire;52100;SAINT-DIZIER;0325073150;0325948720;Site de la mairie;1er janvier, dimanche et lundi de PÉques, 1er et 8 mai, dimanche et lundi de Pentecìte, Ascension, 14 juillet, Assomption 1er et 11 novembre, 25 dÇcembre;Ouvert du mardi au dimanche de 14h Ö 18h et le samedi de 14h Ö 18h;
CHAMPAGNE-ARDENNE;MARNE;;MusÇe du Cloåtre de Notre-Dame-en-Vaux;Rue Nicolas Durant;51000;CHALONS-EN-CHAMPAGNE;0326640387;0326693842;;1er janvier, 1er mai, 11 novembre, 25 dÇcembre;Ouvert du 1er avril au 30 septembre du mercredi au lundi de 10h Ö 12h et de 14h Ö 18h et du 1er octobre au 31 mars du lundi au vendredi de 10h Ö 12h et de 14h Ö 17h et du samedi au dimanche de 10h Ö 12h et de 14h Ö 18h;
CHAMPAGNE-ARDENNE;MARNE;;MusÇe Garinet;13, rue Pasteur;51000;CHALONS-EN-CHAMPAGNE;0326693853;0326693842;;1er janvier, 1er mai, 1er & 11 novembre, 25 dÇcembre;Ouvert sur rendez-vous uniquement, premier dimanche du mois et Çvänements nationaux Ö partir du 1er janvier 2015;
CHAMPAGNE-ARDENNE;MARNE;;MusÇe Municipal;Place Alexandre Godart;51000;CHALONS-EN-CHAMPAGNE;0326693853;0326693842;www.chalonsenchampagne.fr/culture/musees;1er janvier, 1er mai, 1er & 11 novembre, 25 dÇcembre;Ouvert du lundi au vendredi de 14h Ö 18h, samedi de 10h Ö 12h et de 14h Ö 18h, dimanche de 10h Ö 12h et de 14h30 Ö 18h30;
CHAMPAGNE-ARDENNE;MARNE;;MusÇe Municipal d'Epernay;13, Avenue de Champagne;51200;EPERNAY;0326519031;0326519031;www.epernay.fr/equipement-service-municipal/le-futur-musee-regional-darcheologie-et-du-vin-de-champagne;;;
CHAMPAGNE-ARDENNE;MARNE;;EcomusÇe de la Montagne de Reims;"Maison du Parc
Chemin de Nanteuil";51160;POURCY;0326594444;0326594163;www.parc-montagnedereims.fr;;;
CHAMPAGNE-ARDENNE;MARNE;;MusÇe des Beaux-Arts de Saint-Denis;8, Rue Chanzy;51100;REIMS;0326353600;0326868775;site de la ville;1er janvier, 1er mai, 14 juillet, 1er et 11 novembre, 25 dÇcembre;Ouvert du mercredi au lundi de 10h Ö 12h et de 14h Ö 18h, du 14 dÇcembre 2012 au 26 mai 2013 le jeudi de 10h Ö 20h;
CHAMPAGNE-ARDENNE;MARNE;;MusÇe Saint-RÇmi;53, rue Simon;51100;REIMS;0326353690;0326820799;Site de la ville;1er janvier, 1er mai, 14 juillet, 1er et 11 novembre, 25 dÇcembre;Ouvert du lundi au vendredi de 14h Ö 18h30  samedi et le dimanche de 14h Ö 19h;
CHAMPAGNE-ARDENNE;MARNE;;MusÇe Hìtel le Vergeur;36, Place du Forum;51100;REIMS;0326472075;0326477953;www.museelevergeur.com;1er janvier, 1er mai, 14 juillet, 1er novembre, 25 dÇcembre;Ouvert du mardi au dimanche de 14h Ö 18h;
CHAMPAGNE-ARDENNE;MARNE;;MusÇe de l'Ancien Colläge des JÇsuites;"Direction de la Culture de la ville de Reims
1, place Museux";51100;REIMS;0326353470;0326353492;;;;
CHAMPAGNE-ARDENNE;MARNE;;MusÇe de l'Argonne Viard-Morel;Place GÇnÇral Leclerc;51800;SAINTE-MENEHOULD;0326608021;0326606254;;;;
CORSE;CORSE DU SUD;;MusÇe NapolÇonien;"Hotel de Ville
Avenue Antoine Serafini";20000;AJACCIO;0495515253;0495218094;http://www.napoleon.org ou http://www.ajaccio.fr/;;Ouvert du 15 juin au 15 septembre du lundi au vendredi de 9h Ö 11h45 et de 14h Ö 17h45 et du 16 septembre au 14 juin du lundi au vendredi de 9h Ö 11h45 et de 14h Ö  16h45;
CORSE;CORSE DU SUD;;MusÇe de la Maison Bonaparte;Rue Saint-Charles;20000;AJACCIO;0495214389;0495216132;www.musee-maisonbonaparte.fr - www.musees-nationaux-napoleoniens.org;25 janvier 1er janvier;Ouvert du 1er octobre au 31 mars de 10h30 Ö 12h30 et de 13h15 Ö 16h30, du 1er avril au 30 septembre de 10h30 Ö 12h30 et de 13h15 Ö 18h;
CORSE;CORSE DU SUD;;MusÇe Fesch;50-52, rue du Cardinal Fesch;20000;AJACCIO;0495262626;0495218094;www.musee-fesch.com;;Ouvert le lundi, mercredi, samedi de 10h Ö 17h et le jeudi vendredi et dimanche du 3eme week end du mois de 12h Ö 17h du 1er octobre  au 30 avril, et le lundi mercredi, samedi de 10h30 Ö 18h et le jeudi, vendredi et dimanche de 12h00 Ö 18h du 1er mai au 3;Jusqu'Ö 20h30 le vendredi en juillet-aoñt
CORSE;CORSE DU SUD;;MusÇe de l'Alta Rocca;"Quartier Prato
Avenue Lieutenant Aviateur de Peretti";20170;LEVIE;0495780078;0495784160;http://www.levie-altarocca.com;1er janvier, 1er mai, 14 juillet, 15 aoñt, 25 dÇcembre;Ouvert du lundi au samedi d'octobre Ö mai de 10h Ö 17h et de juin Ö septembre tous les jours de 10h Ö 18h;
CORSE;CORSE DU SUD;;MusÇe de PrÇhistoire Corse;Boulevard Jacques Nicolai;20100;SARTENE;0495770109;0495770109;;;;
CORSE;HAUTE-CORSE;;MusÇe DÇpartemental d'ArchÇologie d'AlÇria;Fort de Matra;20270;ALERIA;0495570092;0495570550;www.cg2b.fr;1er janvier, 1er mai, 1er et 11 novembre, 25 dÇcembre;Ouvert du 16 mai au 30 septembre de 9h Ö 12h et de 13h Ö 18h et du 1er octobre au 15 mai de 8h Ö 12h et de 13h Ö 17h;
CORSE;HAUTE-CORSE;;MusÇe de Bastia;"Place du donjon
La Citadelle";20200;BASTIA Cedex;0495310912;0428270099;www.musee-bastia.com;1er et 11 novembre, 1er et 8 mai, et pendant les vacances scolaires de Noâl;Ouvert du 1er mai au 30 septembre de 10h Ö 18h30, tous les jours en juillet aoñt, du 1er octobre au 30 avril de 9h Ö 12h et de 14h Ö17h (basse saison);
CORSE;HAUTE-CORSE;;MusÇe de la Corse;"La Citadelle
B.P. 73";20250;CORTE;0495452545;0495452536;www.musee-corse.com;1er mai, 24 dÇcembre, autres jours fÇriÇs, 31 dÇcembre au 14 janvier inclus;Ouvert du 1er novembre au 31 mars de 10h Ö 17h du lundi au samedi, du 1er avril au 21 juin de 10h Ö 18h du mardi au dimanche, du 22 juin au 20 septembre de 10h Ö 20h tous les jours, du 22 septembre au 31 octobre de 10h Ö 18h du mardi au dimanche;Du 22 juin au 21 septembre jusqu'Ö 20h (tous les jours)
CORSE;HAUTE-CORSE;;MusÇe ArchÇologique de Mariana - Prince Rainier III de Monaco;Mairie de Lucciana;20290;LUCCIANA;;;http://www.lucciana.fr/mariana,-site-historique-le-musee-archeologique-de-mariana-%20-%C2%AB-prince-rainier-iii-de-monaco-%C2%BB_202.html;;;
CORSE;HAUTE-CORSE;;MusÇe DÇpartemental Pascal Paoli;Hameau de la Stretta 20261;20218;MOROSAGLIA;0495610497;0495463137;www.cg2b.fr;1er janvier, 1er et 8 mai, 1er et 11 novembre et 25 janvier;Ouvert du 16 mai au 30 septembre de 9h Ö 12h et de 13h Ö 18h et du 1er octobre au 15 mai de 8h Ö 12h et de 13h Ö 17h;
FRANCHE-COMTE;DOUBS;;MusÇe des Beaux-Arts et d'ArchÇologie;1, Place de la RÇvolution;25000;BESANCON;0381878067;0381800653;www.mbaa.besancon.fr;1er janvier, 1er mai, 1er novembre et 25 dÇcembre;Ouvert le lundi, mercredi au vendredi de 9h30 Ö 12h et de 14h Ö 18h, samedi dimanche de 9h30 Ö 18h;Les jeudis de 18h Ö 20h en pÇriode d'expositions temporaires
FRANCHE-COMTE;DOUBS;;MusÇum de Besanáon;"La Citadelle
Rue des FusillÇs de la RÇsistance";25000;BESANCON;0381878305;0381878306;www.citadelle.com;25 dÇcembre, 1er janvier;Ouverture de la Citadelle du mercredi au lundi du 2 janvier au 29 mars de 10h Ö 17h, du 30 mars au 4 juillet tlj de 9h Ö 18h, du 5 juillet au 24 aoñt tlj de 9h Ö 19h, du 25 aoñt au 25 octobre tlj de 9h Ö 18h, du 26 octobre au 5 novembre tlj de 10h Ö 17h30;
FRANCHE-COMTE;DOUBS;;MusÇe de la rÇsistance et de la DÇportation;"La Citadelle
Rue des FusillÇs";25000;BESANCON;0381878312;0381878313;www.citadelle.com;1er janvier, 25 dÇcembre;Ouvert de novembre Ö mars du mercredi au lundi de 10h Ö 16h45, d'avril Ö mai et de septembre Ö octobre tous les jours de 9h Ö 17h45 et en juillet aoñt tous les jours de 9h Ö 18h45;
FRANCHE-COMTE;DOUBS;;MusÇe Comtois;"LA CITADELLE
Rue des FusillÇs";25000;BESANCON;0381878316;0381878306;www.citadelle.com;1er janvier, 25 dÇcembre;Ouvert de novembre Ö mars de 10h Ö 16h45 et d'avril Ö octobre de 9h Ö 17h45 (18 h 45 en juillet et aoñt);
FRANCHE-COMTE;DOUBS;;MusÇe du Temps;96, Grande rue;25000;BESANCON;0381878161;0381878160;www.besancon.fr/museedutemps;1er janvier, 1er mai, 1er novembre, 25 dÇcembre;Ouvert du mardi au samedi de 9h15 Ö 12h et de 14h Ö 18h , dimanche et jours fÇriÇs de 10h Ö 18h;
FRANCHE-COMTE;DOUBS;;MusÇe Beurnier-Rossel;"8, Place Saint-Martin
B.P. 95287";25200;MONTBELIARD;0381992261;0381992212;www.montbeliard.fr;1er janvier, 1er mai, 1er novembre, 25 dÇcembre;Ouvert du mercredi au lundi de 10h Ö 12h et de 14h Ö 18h;
FRANCHE-COMTE;DOUBS;;MusÇe du ChÉteau des Ducs de Wurtemberg;B.P. 95287;25205;MONTBELIARD Cedex;0381992261;0381992212;www.montbeliard.fr;1er janvier, 1er mai, 1er novembre, 25 dÇcembre;Ouvert du mercredi au lundi de 10h Ö 12h et de 14h Ö 18h;
FRANCHE-COMTE;DOUBS;;MusÇe de Plein Air des Maisons Comtoises;Rue du MusÇe;25360;NANCRAY;0381552977;0381552397;www.maisons-comtoises.org;musÇe fermÇ de mi-novembre Ö fin mars;Ouvert de mars Ö avril de 13h30 Ö 18h30, les dimanche et jours fÇriÇs de 10h Ö 18h30, en mai-juin tlj de 10h Ö 18h30, en juillet-aoñt jusqu'au 14 septembre tlj de 10h Ö 19h, et du 15 septembre au 11 novembre de 13h Ö 18h, les dimanches et jours fÇriÇs de;
FRANCHE-COMTE;DOUBS;;MusÇe-Maison Natale Gustave Courbet;1, Place Robert Fernier;25290;ORNANS;0381622330;0381258845;http://www.musee-courbet.fr;1er janvier, 1er mai, 1er novembre, 25 dÇcembre;Ouvert d'avril Ö juin du mercredi au lundi de 10h Ö 12h et de 14h Ö 18h, d'octobre Ö mars de 9h Ö 12h et de 14h Ö 17h, et du 1er juillet au 30 septembre de  10h Ö 18h;
FRANCHE-COMTE;DOUBS;;MusÇe de Pontarlier;2, Place d'Aráon;25300;PONTARLIER;0381388214;0381388219;Site de la ville;1er & 2 janvier, 1er mai, 1er novembre, 25 dÇcembre;Ouvert le lundi et du mercredi au vendredi de 10h Ö 12h et de 14h Ö 18h, samedi, dimanche et jours fÇriÇs de 14h Ö 18h.;
FRANCHE-COMTE;HAUTE-SAONE;;MusÇe DÇpartemental Albert Demard;ChÉteau de Champlitte;70600;CHAMPLITTE;0384678200;0384678209;www.cg70.fr/decouvertes/musee;1er mai, 1er et 11 novembre, et congÇs scolaires de fin d'annÇe - fermeture de mi-novembre Ö mi-fÇvrier (sauf groupes sur demande);Ouvert du 1er avril au 30 septembre de 9h30 Ö 12h et de 14h Ö 18h et  du 1er octobre au 31 mars de 14h Ö 17h et de mi-fÇvrier-31 mars de 14h Ö 17h;
FRANCHE-COMTE;HAUTE-SAONE;;EcomusÇe du Pays de la Cerise;206, Le Petit Fahyr;70220;FOUGEROLLES;0384495250;0384495203;www.musees-des-techniques.org;;Ouvert du 15 fÇvrier au 30 juin et du 1er septembre au 15 novembre du mercredi au dimanche de 14h Ö 18h, en juillet-aoñt du lundi au samedi de 11h Ö 19h, le dimanche de 14h Ö 19h;
FRANCHE-COMTE;HAUTE-SAONE;;MusÇe Baron Martin;6, rue Edmond Pigalle;70100;GRAY;0384656910;0384652229;/www.musee-baronmartin.fr;1er janvier, 1er mai, 1er et 11 novembre, 24, 31 dÇcembre;Ouvert du 2  janvier au 30 avril et du 1er octobre au 31 dÇcembre de 14h Ö 17h du mercredi au lundi, et du 2 mai au 30 septembre de 10h Ö 12 h et de 14h Ö 18h du mercredi au lundi;
FRANCHE-COMTE;HAUTE-SAONE;;MusÇe DÇpartemental de la Montagne Albert Demard;ChÉteau-Lambert;70440;LE HAUT-DU-THEM;0384204309;0384204709;http://musees.cg70.fr;1er mai, 1er et 11 novembre, matin des jours fÇriÇs, pendant les vacances scolaires de fin d'annÇe;Ouvert du 1er fÇvrier au 31 mars le lundi et du mercredi au vendredi de 14h Ö 17h, week-end de 14h Ö 17h, du 1er avril au 30 juin et en septembre de  9h30 Ö 12h et de 14h Ö 18h,  en  juillet-aoñt de  9h30 Ö 19h du lundi au samedi et  le dimanche de 14h-19;
FRANCHE-COMTE;HAUTE-SAONE;;MusÇe de la Tour des Echevins;36, Rue Victor Genoux;70300;LUXEUIL-LES-BAINS;0384400007;;www.luxeuil.fr;Novembre Ö avril;Ouvert de mai Ö octobre de 14h Ö 18h du mercredi au lundi;
FRANCHE-COMTE;HAUTE-SAONE;;MusÇe Georges Garret;1, Rue des Ursulines;70000;VESOUL;0384765154;0384767969;Site des musÇes de la rÇgion;1er janvier, 1er mai, 25 novembre, lundi de PÉques, vacances de Noâl;Ouvert du mercredi au lundi de 14h Ö 18h. Groupes sur rÇservation le matin;
FRANCHE-COMTE;JURA;;MusÇe de la Vigne et du Vin;"ChÉteau PÇcauld
B.P. 41";39600;ARBOIS;0384664045;0384664046;http://www.juramusees.com/musee-vigne-vin/musee-vigne-vin.htm;Janvier hors vacances scolaires, 1er mai, 25 dÇcembre;Ouvert de novembre Ö fÇvrier de 14h Ö 18h du mercredi au lundi, de mars Ö octobre de 10h Ö 12h et de 14h Ö 18h du mercredi au lundi, en juillet-aìut tous les jours de 10h Ö 12h30 et de 14h Ö 18h. Visites guidÇes toute l'annÇe pour les groupes.;
FRANCHE-COMTE;JURA;;MusÇe Sarret de Grozon;Grande Rue;39600;ARBOIS;0384374790;0384662550;Site des musÇes de la rÇgion;;Ouvert du 1er juillet au 31 aoñt de 15h Ö 18h30 du mercredi au lundi et du 1er au 16 septembre du jeudi au dimanche de 15h Ö 18h30;
FRANCHE-COMTE;JURA;;MusÇe Municipal d'ArchÇologie;26, rue Baronne Delort;39300;CHAMPAGNOLE;0384530129;0384524932;www.tourisme.champagnole.com;Jours fÇriÇs;Ouvert du mercredi au lundi en juillet et aoñt de 14h Ö 18h + journÇes du patrimoine. Ouvert toute l'annÇe pour les groupes sur rÇservation;
FRANCHE-COMTE;JURA;;MusÇe des Beaux-Arts;85, rue des Aränes;39100;DOLE;0384792585;0384728946;Site de la ville ou site des musÇes de la rÇgion;1er mai, 1er novembre, du 24 dÇcembre au 1er janvier;Ouvert mardi, jeudi, vendredi et samedi de 10h Ö 12h et de 14h Ö 18h, le mercredi de 10h Ö 12h et de 14h Ö 20h, dimanche de 14h Ö 18h;Mercredi jusqu'Ö 20h
FRANCHE-COMTE;JURA;;MusÇe des Beaux-Arts;Place Philibert de ChÉlon;39000;LONS-LE-SAUNIER;0384476430;0384478896;Site des musÇes de la rÇgion;1er janvier, 1er mai, 25 dÇcembre;Ouvert du mardi au vendredi de 14h Ö 17h, samedi, dimanche et jours fÇriÇs de 14h Ö 18h;
FRANCHE-COMTE;JURA;;MusÇe d'ArchÇologie;7, Rue des Cordeliers;39000;LONS-LE-SAUNIER;0384478845;0384478545;Site de la ville;;Pas de salle d'expositions actuellement, mais maintien de confÇrences et animations toute l'annÇe;
FRANCHE-COMTE;JURA;;MusÇe du Jouet;5, Rue du Murgin;39260;MOIRANS-EN-MONTAGNE;0384423864;0384423897;www.musee-du-jouet.fr et Site des musÇes de la rÇgion;1er janvier, 1er novembre, 25 dÇcembre,;Ouvert de septembre Ö juin lundi, mercredi au vendredi de 10h Ö 12h30 et de 14h Ö 18h30, samedi et dimanche de 14h30 Ö 18h30, et en juillet aoñt tous les jours de 10h Ö 19h;
FRANCHE-COMTE;JURA;;VisÇum-MusÇe de la Lunette;Place Jean Jauräs;39400;MOREZ HAUTS DE BIENNE;0384333930;0384332642;www.musee-lunette.fr ou www.musees-franchecomte.com;Jours fÇriÇs et du 1er au 25 dÇcembre inclus;Ouvert du mercredi au lundi de 10h Ö 12h et de 14h Ö 18h, juillet-aoñt de 10h Ö 18h;
FRANCHE-COMTE;JURA;;MusÇe Municipal de Poligny;"Hìtel de Ville
49, Grande Rue";39800;POLIGNY;0384737171;0384371030;www.musee-poligny.fr;;;
FRANCHE-COMTE;JURA;;MusÇe de l'Abbaye/Donations Guy Bardone - RenÇ Genis;3, Place de l'Abbaye;39200;SAINT-CLAUDE;0384381260;0384422537;www.museedelabbaye.fr;1er janvier, 1er mai, 1er novembre, 25 dÇcembre;Ouvert du 1er septembre au 30 juin du mercredi au dimanche de 10h Ö 12h et de 14h Ö 18h et du 1er juillet au 31 aìut du mercredi au lundi de 10h Ö 12h et de 14h Ö 18h;
FRANCHE-COMTE;JURA;;MusÇe Max Claudet;Place des Salines;39110;SALINS-LES-BAINS;0384730134;;http://www.juramusees.fr/1/musee/musees/beaux_arts/musee_max_claudet_salins_les_bains.html;;;
FRANCHE-COMTE;JURA;;MusÇe des Salines;Place des Salines;39110;SALINS-LES-BAINS;0384731092;0384379285;www.salinesdessalins.com ou www.musees-des-techniques.org;1er janvier, 1äre semaine de janvier, 25 dÇcembre;Ouvert de janvier Ö mars et de novembre Ö dÇcembre tous les jours de 10h Ö 12h et de 14h Ö 17h, visites guidÇes Ö 10h30, 14h15 et 15h30. D'avril Ö mai et en octobre tous les jours de 9h Ö 12h et de 14h Ö 18h, visites guidÇes Ö 9h30, 10h30, 14h15, 15h30 et;
FRANCHE-COMTE;JURA;;MusÇe de l'Artisanat Jurassien;Abbaye de Baume-Les-Messieurs;39210;VOITEUR;0384873300;0384449545;;;Ouvert en juillet-aoñt et les week-end de septembre Ö octobre;
FRANCHE-COMTE;TERRITOIRE DE BELFORT;;MusÇe FrÇdÇric Japy;16, Rue FrÇdÇric Japy;90500;BEAUCOURT;0384565752;0384569733;www.musees-des-techniques.org ou www.ville-beaucourt.fr;1er fÇvrier au 1er mars - 1er mai, 1er novembre;Ouvert du 1er mercredi de mars au dernier dimanche avant Noâl du mercredi au dimanche de 14h Ö 17h;
FRANCHE-COMTE;TERRITOIRE DE BELFORT;;Donation Maurice Jardot;"MusÇe(s) de Belfort
B.P. 20223";90004;BELFORT Cedex;0384904070;0384904071;www.musees-franchecomte.com;Le 1er novembre, le 25 dÇcembre et le 1er janvier;Ouvert du 1er octobre au 31 mars du mercredi au lundi de 9h Ö 12h et de 14h Ö 17h, du 1er avril au 31 juin et en septembre du mercredi au lundi de 9h Ö 12h et de 14h Ö 18h, du 1et juillet au 31 aoñt tous les jours de 9h Ö 18h;
FRANCHE-COMTE;TERRITOIRE DE BELFORT;;MusÇe d'Art et d'Histoire;"ChÉteau de Belfort
B.P. 733";90020;BELFORT cedex;0384542551;0384285296;www.musees-franchecomte.com ou http://www.ville-belfort.fr/;le 1er novembre, 25 dÇcembre, 1er janvier;Ouvert du 1er octobre au 31 mars du mercredi au lundi de 9h Ö 12h et de 14h Ö 17h, du 1er avril au 31 juin et en septembre du mercredi au lundi de 9h Ö 12h et de 14h Ö 18h, du 1et juillet au 31 aoñt tous les jours de 9h Ö 18h;
FRANCHE-COMTE;TERRITOIRE DE BELFORT;;Forge-MusÇe;2, Rue de Lamadeleine;90170;ETUEFFONT;0384546041;0956369101;www.musees-des-techniques.org ou www.cc-pays-sous-vosgien.fr;;Ouvert du 1er avril au 30 septembre du mercredi au dimanche de 14h Ö 18h et en octobre du vendredi au dimanche de 14h Ö 18h;
GUADELOUPE;GUADELOUPE;;EcomusÇe de Marie-Galante;Habitation Murat;97112;GRAND-BOURG de MARIE-GALANTE;0590974868;0590979441;;;Ouvert du lundi au vendredi de 9h Ö 17h30 et samedi dimanche de 9h Ö 13h30 depuis le 8 mars 2008;
GUADELOUPE;GUADELOUPE;;MusÇe PrÇcolombien Edgar Clerc;440 Route de la Rosette;97160;LE MOULE;0590235757;0590238967;www.cg971.fr/musees/clerc/index_edgar.htm;Jours fÇriÇs;Ouvert du lundi au vendredi de 9h Ö 17h;
GUADELOUPE;GUADELOUPE;;MusÇe Municipal Saint-John Perse;9, rue de Noziäre;97110;POINTE-A-PITRE;0590900192;0590839831;www.sjperse.org/museesjp.htm;Jours fÇriÇs;Ouvert du lundi au vendredi de 9h Ö 17h, le  samedi de 8h30 Ö 12h30;
GUADELOUPE;GUADELOUPE;;MusÇe l'Herminier;"Office du Tourisme
1 Centre Commercial Marina";97110;POINTE-A-PITRE;0590820930;0590838922;;;;
GUADELOUPE;GUADELOUPE;;MusÇe DÇpartemental Victor Schoelcher;24, Rue Peynier;97110;POINTE-A-PITRE -GUADELOUPE;0590820804;0590837839;www.cg971.fr/musees/schoelcher/index_schoecher.htm;Jours fÇriÇs;Ouvert du lundi au vendredi de 9h Ö 17h;
GUYANE;GUYANE;;MusÇe des Cultures Guyanaises;78, Rue Mme PayÇ;97300;CAYENNE;0594314172;0594378445;www.mcg973.org ou www.amazonian-museum-network.org;;Ouvert lundi et mardi de 8h Ö 13h et de 15h Ö 17h45, mercredi de 8h Ö 13h, jeudi et vendredi de 8h Ö 13h et de 15h Ö 17h45, samedi de 8h Ö 11h45;
GUYANE;GUYANE;;MusÇe DÇpartemental Alexandre Franconie;1, Avenue du GÇnÇral-de-Gaulle;97300;CAYENNE - GUYANE;0594295913;0594295911;;;"De septembre Ö juin :
Lundi : 10h00-14h00 / 15h00-18h00
Mercredi : 8h00-13h30 / 15h00-18h00
Jeudi : 8h00-14h00
Vendredi : 8h00-14h00 / 15h00-18h00
Samedi : 9h00-13h30
Juillet et aoñt :
Du lundi au vendredi : 8h00-14h30
Samedi : 9h00-13h30";chaque dernier vendredi du mois
GUYANE;GUYANE;;EcomusÇe Municipal d'Approuague-Kaw;"Rue Gaston Monnerville
Le Bourg";97390;REGINA;0594370944;0594370944;http://www.coeurdeforet.fr/guyane/regina-guyane-amazonie/ecomusee-regina;;Ouvert mercredi, vendredi, samedi et dimanche de 9h30 Ö 17h30. Accueil Ö la carte et sur rendez-vous pour les groupes. Ouvert lors des vacances scolaires de 9h30 Ö 17h30 sauf le mardi;
ILE-DE-FRANCE;ESSONNE;;MusÇe Franáais de la Photographie;78, Rue de Paris;91570;BIEVRES;0169351650;0160192111;www.museedelaphoto.fr;Jours fÇriÇs;"Ouvert du mercredi au dimanche de 13h30 Ö 17h30
Accueil des groupes du mercredi au dimanche de 9h30 Ö 17h30";
ILE-DE-FRANCE;ESSONNE;;MusÇe Dunoyer de Segonzac;5, Place des Droits de l'Homme;91800;BOUSSY-SAINT-ANTOINE;;;;;;
ILE-DE-FRANCE;ESSONNE;;MusÇe Municipal Robert Dubois-Corneau;16, Rue du RÇveillon;91800;BRUNOY;0160463360;0160472920;www.brunoy.fr;Aoñt  et jours fÇriÇs et du 25 dÇcembre 2010 au 4 janvier 2011;Ouvert du mercredi au dimanche de 14h Ö 18h du 1er mai au 31 octobre et de 14h Ö 17h du 1er novembre au 30 avril. Pour les scolaire ouvert du mercredi au vendredi de 9h Ö 12h et de 14h Ö 17h;
ILE-DE-FRANCE;ESSONNE;;MusÇe du ChÉteau;Place du GÇnÇral de Gaulle;91410;DOURDAN;0164596683;0164592165;Site de la ville - www.mairie-dourdan.fr;1er au 14 Janvier, 25 dÇcembre;Ouvert du mercredi au dimanche et les jours fÇriÇs de 10 h Ö 12 h et de 14 h Ö 18 h, 17h le vendredi;
ILE-DE-FRANCE;ESSONNE;;MusÇe Intercommunal d'Etampes;Place de l'Hìtel de Ville;91150;ETAMPES;0169926912;0169926903;site de la ville;1er janvier, 1er et 8 mai, 1er et 11 novembre, 25 dÇcembre;Ouvert du mercredi au dimanche de 14h Ö 17h;
ILE-DE-FRANCE;HAUTS DE SEINE;;Albert-Kahn, MusÇe et Jardin DÇpartementaux;10-14, Rue du Port;92100;BOULOGNE-BILLANCOURT;0155192803;0146038659;albert-kahn.hauts-de-seine.fr/;25 dÇcembre 2011 au 2 janvier 2012;Ouvert du mardi au dimanche de 11h Ö 18h d'octobre Ö avril et de 11h Ö 19 h de mai Ö septembre;
ILE-DE-FRANCE;HAUTS DE SEINE;;MusÇe des AnnÇes Trente;"Espace Landowski
28, avenue AndrÇ Morizet";92100;BOULOGNE-BILLANCOURT;0155184642;0155185158;www.annees30.com;1er janvier, 1er mai, 25 dÇcembre;Ouvert du mardi au dimanche de 11h Ö 18h;
ILE-DE-FRANCE;HAUTS DE SEINE;;MusÇe Belmondo et de la Sculpture Figurative du XXä siäcle;"ChÉteau Buchillot
14, Rue de l'Abreuvoir";92100;BOULOGNE-BILLANCOURT;0155186901;;http://www.boulognebillancourt.com;1er janvier, 1er mai, 25 dÇcembre;Ouvert du mardi au vendredi de 14h Ö 18h et du samedi au dimanche de 11h Ö 18h;
ILE-DE-FRANCE;HAUTS DE SEINE;;MusÇe-Jardin Paul Landowski;14, Rue Max Blondat;92100;BOULOGNE-BILLANCOURT;0146058269;;www.boulognebillancourt.com;1er janvier, 1er mai, 25 dÇcembre - Aoñt;Ouvert les mercredi, samedi et dimanche de 10h Ö 12h et de 14h Ö 17h;
ILE-DE-FRANCE;HAUTS DE SEINE;;Fondation Arp;21, Rue des ChÉtaigniers;92140;CLAMART;0145342263;0146238030;www.fondationarp.org;Aoñt, semaine entre Noâl et Nouvel An;Ouverture les vendredi, samedi, dimanche de 14 Ö 18h et sur rendez-vous pour les groupes;
ILE-DE-FRANCE;HAUTS DE SEINE;;MusÇe Municipal d'Art et d'Histoire;2, Rue Gabriel PÇri;92700;COLOMBES;0147863885;0147850075;Site de la ville - www.mairie-colombes.fr;AoÅt et 1 semaine durant les vacances de Noâl;Ouvert du mercredi au samedi de 14h Ö 18h, vendredi de 16h Ö 19h pour les groupes sur rÇservation tout au long de la semaine;
ILE-DE-FRANCE;HAUTS DE SEINE;;MusÇe Roybet Fould;"Parc de BÇcon
178, Boulevard Saint Denis";92400;COURBEVOIE;0143333073;0141169156;https://www.ville-courbevoie.fr/culture-loisirs/equipements/musee-roybet-fould.htm;FermÇ le 1er janvier, 1er mai, PÉques, Toussaint, Noâl;Ouvert du mercredi au lundi de 10h30 Ö 18h;
ILE-DE-FRANCE;HAUTS DE SEINE;;MusÇe des Travaux Publics;Mairie de Courbevoie;92400;COURBEVOIE;0143347000;0147880283;Site de la ville;;;
ILE-DE-FRANCE;HAUTS DE SEINE;;MusÇe Franáais de la Carte Ö Jouer;16, Rue Auguste Gervais;92130;ISSY-LES-MOULINEAUX;0141238360;0141238366;http://www.museecarteajouer.com/;Aoñt et jours fÇriÇs;Ouvert du mercredi au vendredi de 11h Ö 17h, samedi et dimanche de 14h Ö 18h,  juillet-aoñt du mercredi au dimanche de 13h Ö 18h. Groupes sur rendez-vous le mardi;Le jeudi jusqu'Ö 20h lors de la biennale
ILE-DE-FRANCE;HAUTS DE SEINE;MusÇe Rodin de Paris;MusÇe - Atelier Rodin;19, Avenue Auguste Rodin;92190;MEUDON;0141143500;0145343654;www.musee-rodin.fr;;Ouvert du vendredi au dimanche de 13h Ö 18h toute l'annÇe depuis le 31 mars 2012;
ILE-DE-FRANCE;HAUTS DE SEINE;;MusÇe d'Art et d'Histoire;11, Rue des Pierres;92190;MEUDON;0146238713;0146230631;www.meudon.fr;Aoñt;Ouvert du mardi au dimanche de 14h Ö 18h. Pour les groupes et centre de documentation ouvert du lundi au dimanche de 9h Ö 12h et de 14h Ö 18h;
ILE-DE-FRANCE;HAUTS DE SEINE;;MusÇe des Automates;"Hìtel Arturo Lopez
12, Rue du Centre";92200;NEUILLY-SUR-SEINE;0155626090;0155626124;;25 dÇcembre, 1er janvier;MusÇe en travaux ouvert 6 jours en 2010;
ILE-DE-FRANCE;HAUTS DE SEINE;;MusÇe National des ChÉteaux de Malmaison et de Bois-PrÇau;Avenue du ChÉteau de Malmaison;92500;RUEIL-MALMAISON;0141290555;0141290556;www.chateau-malmaison.fr;25 dÇcembre, 1er janvier;Ouvert du mercredi au lundi du 1er octobre au 31 mars de 10h Ö 12h30 et de 13h30 Ö 17h15, week-end 17h45, du 1er avril au 30 septembre de 10h Ö 12h30 et de 13h30 Ö 17h45, week-end 18h15. Ouverture du parc du 1er octobre au 31 mars de 10h Ö 18h et du 1er a;
